{
  "decision_id": "dec_20260310_0081",
  "evaluation_id": "eval_20260310_0022",
  "event_id": "evt_20260310_0001",
  "program_id": "kakheti_hail_relief_2026",
  "rule_version": "rv_2026_03_01",
  "recommended_amount": 1200,
  "currency": "USD",
  "basis_risk_flag": true,
  "requires_manual_review": true,
  "appeal_window_days": 21,
  "status": "REVIEW_REQUIRED"
}
